{
  "$schema": "https://anthropic.com/claude-code/marketplace.schema.json",
  "name": "cc-plugin-marketplace",
  "description": "A curated Claude Code plugin marketplace for managing multiple plugins in a single repository.",
  "owner": {
    "name": "Ice-K"
  },
  "plugins": [
    {
      "name": "spec-flow-kit",
      "description": "Specification-driven workflow helpers for planning, proposing, applying, and archiving structured changes in Claude Code.",
      "category": "development",
      "source": "./plugins/spec-flow-kit"
    }
  ]
}
